id,title,genre_ids,overview,release_date,vote_average,vote_count,poster_path,original_language
574475,Final Destination Bloodlines,"[27, 9648]","Plagued by a violent recurring nightmare, college student Stefanie heads home to track down the one person who might be able to break the cycle and save her family from the grisly demise that inevitably awaits them all.",2025-05-16,7.2,1060,/6WxhEvFsauuACfv8HyoVX6mZKFj.jpg,en
552524,Lilo & Stitch,"[10751, 878, 35, 12]",The wildly funny and touching story of a lonely Hawaiian girl and the fugitive alien who helps to mend her broken family.,2025-05-23,7.107,681,/c32TsWLES7kL1uy6fF03V67AIYX.jpg,en
1087192,How to Train Your Dragon,"[28, 10751, 14]","On the rugged isle of Berk, where Vikings and dragons have been bitter enemies for generations, Hiccup stands apart, defying centuries of tradition when he befriends Toothless, a feared Night Fury dragon. Their unlikely bond reveals the true nature of dragons, challenging the very foundations of Viking society.",2025-06-13,8.048,345,/q5pXRYTycaeW6dEgsCrd4mYPmxM.jpg,en
1426776,STRAW,"[53, 18, 80]",What will be her last straw? A devastatingly bad day pushes a hardworking single mother to the breaking point — and into a shocking act of desperation.,2025-06-06,8.042,566,/t3cmnXYtxJb9vVL1ThvT2CWSe1n.jpg,en
1087891,The Amateur,"[53, 28]","After his life is turned upside down when his wife is killed in a London terrorist attack, a brilliant but introverted CIA decoder takes matters into his own hands when his supervisors refuse to take action.",2025-04-11,6.936,568,/SNEoUInCa5fAgwuEBMIMBGvkkh.jpg,en
1442776,Kuang Bao Ju Xi,"[28, 53, 27]","A young man climbs into the mountains to pick up a meteorite that has fallen there and is killed by something. The ""thing"" descends to the village and begins to eat the inhabitants one by one, terrorizing the entire island.",2024-03-27,6.0,1,/9TFaFsSXedaALXTzba349euDeoY.jpg,zh
1181039,鬼吹灯：献王虫谷,"[28, 12, 27]","Adapted from the 3rd volume in the novel series ""Candle in the Tomb"" by Zhang Mu Ye. Hu Bayi, Wang Kaixuan, and Shiely Yang, infected with a curse, embark on a journey to King Xian's tomb to retrieve the Haochen Bead and break the curse. They face ancient organs, ghostly visions, explosive bugs, and a massive salamander.",2023-09-22,8.0,3,/7Hk1qxAvZi9H9cfBb4iHkoGjapH.jpg,zh
1240475,缉恶,[28],"The film tells the story of narcotics police officer Huang Mingjin and the ""mysterious figure"" Wei Yunzhou. Through completely different means and methods, in the process of calculating and wrestling with each other, they tear apart the facade of urban tranquility, exposing the underground drug network woven by the hidden hand ""Long Wang"", and ultimately eradicate the darkness with the sword of justice, revealing the dawn of light.",2024-02-12,5.571,7,/m5UBHbEjQJx3AkRZWRY6A4l4ZDT.jpg,zh
1376434,Predator: Killer of Killers,"[16, 28, 878]","While three of the fiercest warriors in human history—a Viking raider, a ninja in feudal Japan, and a WWII pilot—are killers in their own right, they are merely prey for their new opponent: the ultimate killer of killers.",2025-06-05,7.988,555,/2XDQa6EmFHSA37j1t0w88vpWqj9.jpg,en
1127110,Diablo,"[28, 53]","Ex-con Kris Chaney seizes the daughter of a Colombian gangster to fulfill a noble promise to the young girl's mother. When her father enlists both the criminal underworld and a psychotic killer to exact his revenge, Kris relies on everything he's ever learned to stay alive and keep his word.",2025-06-13,7.0,32,/uFQduVyYIinJy3eLjozgfl6Xtcn.jpg,en
870028,The Accountant²,"[9648, 80, 53]","When an old acquaintance is murdered, Wolff is compelled to solve the case. Realizing more extreme measures are necessary, Wolff recruits his estranged and highly lethal brother, Brax, to help. In partnership with Marybeth Medina, they uncover a deadly conspiracy, becoming targets of a ruthless network of killers who will stop at nothing to keep their secrets buried.",2025-04-25,7.196,877,/kMDUS7VmFhb2coRfVBoGLR8ADBt.jpg,en
1239193,Deep Cover,"[28, 35, 80]","Kat is an improv comedy teacher beginning to question if she’s missed her shot at success. When an undercover cop offers her the role of a lifetime, she recruits two of her students to infiltrate London’s gangland by impersonating dangerous criminals.",2025-06-10,6.785,158,/euM8fJvfH28xhjGy25LiygxfkWc.jpg,en
1233413,Sinners,"[27, 14, 53]","Trying to leave their troubled lives behind, twin brothers return to their hometown to start again, only to discover that an even greater evil is waiting to welcome them back.",2025-04-18,7.5,1569,/yqsCU5XOP2mkbFamzAqbqntmfav.jpg,en
1289601,Life After Fighting,"[28, 18, 53]","Retired martial arts world champion Alex Faulkner has settled into a simple life, when the disappearance of two of his students leads to an unthinkable discovery close to home. Just when all hope of finding the children is lost, he locates the imprisoned girls and unsurfaces an international child trafficking operation, which draws him back into the fight of his life against those behind it.",2024-06-07,7.077,39,/uKWAk4BHzyEOMmLKUDXoIAPhH36.jpg,en
1379587,Utopia,"[9648, 53, 28, 878]","A soldier searching for his missing wife breaks into a high-tech facility, believing she's been caught in a human trafficking ring. But beyond its walls, he finds a surreal, futuristic fantasy park where reality and illusion blur. As he navigates this seductive and dangerous world, a shocking truth pulls him deeper into a deadly game where nothing is as it seems.",2024-12-10,5.447,38,/yef0tY1Nw3BX8PJTfBLieqHj5Hw.jpg,en
1100988,28 Years Later,"[27, 53, 878]","Twenty-eight years since the rage virus escaped a biological weapons laboratory, now, still in a ruthlessly enforced quarantine, some have found ways to exist amidst the infected. One such group lives on a small island connected to the mainland by a single, heavily-defended causeway. When one member departs on a mission into the dark heart of the mainland, he discovers secrets, wonders, and horrors that have mutated not only the infected but other survivors as well.",2025-06-20,7.381,122,/361hRZoG91Nw6qXaIKuGoogQjix.jpg,en
950387,A Minecraft Movie,"[10751, 35, 12, 14]","Four misfits find themselves struggling with ordinary problems when they are suddenly pulled through a mysterious portal into the Overworld: a bizarre, cubic wonderland that thrives on imagination. To get back home, they'll have to master this world while embarking on a magical quest with an unexpected, expert crafter, Steve.",2025-04-04,6.5,1846,/yFHHfHcUgGAxziP1C3lLt0q2T4s.jpg,en
1311844,The Twisters,"[28, 12, 18]","A deadly patchwork of destructive cyclones is on an apocalyptic path of convergence at a populated Midwest city center. There, the twisters will merge into one mega tornado that threatens to obliterate the cities for hundreds of miles around.",2024-06-28,4.1,9,/8OP3h80BzIDgmMNANVaYlQ6H4Oc.jpg,en
605722,Distant,"[878, 35, 28]","After crash-landing on an alien planet, an asteroid miner must contend with the challenges of his new surroundings, while making his way across the harsh terrain to the only other survivor – a woman who is trapped in her escape pod.",2024-07-12,6.2,118,/czh8HOhsbBUKoKsmRmLQMCLHUev.jpg,en
666154,Kayara,"[12, 16, 10751]","A courageous and athletic teenager, Kayara dreams that she is destined to be the first female to break into the league of Chasquis - the official messengers of the Incan empire. As she learns what it takes to be a Chasqui along with its challenges, she tackles every mission she gets and discovers the ancient stories of her land and her people.",2025-03-30,7.557,53,/tpZdjnoJ6Z3NsSxI6HjAIggrcEv.jpg,en
1017163,범죄도시 4,"[28, 80, 18, 53, 35]",'Monster Cop' Ma Seok-do investigates an illegal online gambling business led by a former STS Baek and an IT genius CEO Chang. Ma proposes an unexpected alliance to Jang and begins hunting down the criminals.,2024-05-03,6.854,140,/yk38mNoJpsswmk9o7i7eLhO4mc.jpg,ko
1450599,K.O.,"[28, 18, 12]","A former fighter must find the missing son of an opponent he accidentally killed years ago, taking on a brutally violent crime gang in Marseille.",2025-06-06,6.622,139,/qcM2sUiAeP4zXwx4ADSvgc9S58k.jpg,fr
1315988,Mikaela,"[28, 53]","During the eve of the 6th of January, a record-breaking snowstorm sweeps across Spain. In the midst of its chaos, a group of robbers seizes the opportunity to hijack an armoured van. A few meters away is Leo, a finished policeman who has nothing to lose. With the unexpected aid of a young woman, he will try to stop the band from running away with their loot.",2025-01-31,6.163,52,/xG8olkWOmoW78GbozKbS2UxYGEo.jpg,es
1152619,Possessions,[27],"Follows a father who seeks a fresh start with his son after the loss of his wife, and purchased a storage unit facility sight unseen, but secrets buried behind the metal doors become a parent's worst nightmare.",2024-04-12,4.0,18,/39a7zYZvkGfs7EOVVK3dQlWyYJ0.jpg,en
575265,Mission: Impossible - The Final Reckoning,"[28, 12, 53]","Ethan Hunt and team continue their search for the terrifying AI known as the Entity — which has infiltrated intelligence networks all over the globe — with the world's governments and a mysterious ghost from Hunt's past on their trail. Joined by new allies and armed with the means to shut the Entity down for good, Hunt is in a race against time to prevent the world as we know it from changing forever.",2025-05-23,7.159,828,/z53D72EAOxGRqdr7KXXWp9dJiDe.jpg,en
541671,Ballerina,"[28, 53, 80]","Taking place during the events of John Wick: Chapter 3 – Parabellum, Eve Macarro begins her training in the assassin traditions of the Ruska Roma.",2025-06-06,7.081,340,/mKp4euM5Cv3m2U1Vmby3OGwcD5y.jpg,en
1180648,Kuća od blata,"[27, 18]","After inheriting an old mudbrick house in his home village in Eastern Europe, a man returns after spending his whole life in England, only to find out that inhabitants are hiding a dark secret about the pagan Slavic cult and his own past.",2024-12-13,4.5,6,/paVJNyxq5odaAHC9YlmNUlceQpu.jpg,sr
1284120,Den stygge stesøsteren,"[27, 35, 14, 18]","In a fairy-tale kingdom where beauty is a brutal business, Elvira battles to compete with her incredibly beautiful stepsister, and she will go to any length to catch the prince’s eye.",2025-04-18,7.1,191,/crX9rSg9EohybhkEe8iTQUCe55y.jpg,no
1197306,A Working Man,"[28, 80, 53]","Levon Cade left behind a decorated military career in the black ops to live a simple life working construction. But when his boss's daughter, who is like family to him, is taken by human traffickers, his search to bring her home uncovers a world of corruption far greater than he ever could have imagined.",2025-03-28,6.688,1272,/6FRFIogh3zFnVWn7Z6zcYnIbRcX.jpg,en
1449951,Snow White,"[16, 10751, 14]","When the Queen’s jealousy turns deadly, Snow White must join forces with gnomes to fight back against her stepmother’s wrath.",2025-03-07,7.429,7,/ilFLHU1OxUS1YDvUMCr8K3hW28r.jpg,en
447273,Snow White,"[10751, 14]","Following the benevolent King's disappearance, the Evil Queen dominated the once fair land with a cruel streak. Princess Snow White flees the castle when the Queen, in her jealousy over Snow White's inner beauty, tries to kill her. Deep into the dark woods, she stumbles upon seven magical dwarves and a young bandit named Jonathan. Together, they strive to survive the Queen's relentless pursuit and aspire to take back the kingdom.",2025-03-21,4.281,1155,/xWWg47tTfparvjK0WJNX4xL8lW2.jpg,en
170,28 Days Later,"[27, 53, 878]","Twenty-eight days after a killer virus was accidentally unleashed from a British research facility, a small group of London survivors are caught in a desperate struggle to protect themselves from the infected. Carried by animals and humans, the virus turns those it infects into homicidal maniacs -- and it's absolutely impossible to contain.",2003-06-27,7.239,7267,/sQckQRt17VaWbo39GIu0TMOiszq.jpg,en
1403735,లైలా,"[35, 10749]","Sonu Model, a renowned beautician from the old city, is forced to disguise himself as Laila, leading to a series of comedic, romantic, and action-packed events. Chaos ensues in this hilarious laugh riot",2025-02-14,5.8,5,/l4gsNxFPGpzbq0D6QK1a8vO1lBz.jpg,te
1097311,Echo Valley,"[53, 18]","Kate lives a secluded life—until her troubled daughter shows up, frightened and covered in someone else's blood. As Kate unravels the shocking truth, she learns just how far a mother will go to try to save her child.",2025-06-13,6.5,126,/3Ey3HuqZdrx1rfxRkfiOXDFtvtl.jpg,en
803796,KPop Demon Hunters,"[14, 28, 35, 16, 10402]","When K-pop superstars Rumi, Mira and Zoey aren't selling out stadiums, they're using their secret powers to protect their fans from supernatural threats.",2025-06-20,8.8,44,/jfS5KEfiwsS35ieZvdUdJKkwLlZ.jpg,en
1241982,Moana 2,"[16, 12, 10751, 35]","After receiving an unexpected call from her wayfinding ancestors, Moana journeys alongside Maui and a new crew to the far seas of Oceania and into dangerous, long-lost waters for an adventure unlike anything she's ever faced.",2024-11-27,7.075,2486,/aLVkiINlIeCkcZIzb7XHzPYgO6L.jpg,en
10191,How to Train Your Dragon,"[14, 12, 16, 10751]","As the son of a Viking leader on the cusp of manhood, shy Hiccup Horrendous Haddock III faces a rite of passage: he must kill a dragon to prove his warrior mettle. But after downing a feared dragon, he realizes that he no longer wants to destroy it, and instead befriends the beast – which he names Toothless – much to the chagrin of his warrior father.",2010-03-26,7.845,13506,/ygGmAO60t8GyqUo9xYeYxSZAR3b.jpg,en
986056,Thunderbolts*,"[28, 878, 12]","After finding themselves ensnared in a death trap, seven disillusioned castoffs must embark on a dangerous mission that will force them to confront the darkest corners of their pasts.",2025-05-02,7.4,1143,/hBH50Mkcrc4m8x73CovLmY7vBx1.jpg,en
757725,Shadow Force,"[28, 18, 53]","Kyrah and Isaac were once the leaders of a multinational special forces group called Shadow Force. They broke the rules by falling in love, and in order to protect their son, they go underground. With a large bounty on their heads, and the vengeful Shadow Force hot on their trail, one family's fight becomes all-out war.",2025-05-09,6.413,80,/7IEW24vBiZerZrDlgLVSUU3oT1C.jpg,en
1241436,Warfare,"[10752, 28]","A platoon of Navy SEALs embarks on a dangerous mission in Ramadi, Iraq, with the chaos and brotherhood of war retold through their memories of the event.",2025-04-11,7.178,604,/srj9rYrjefyWqkLc6l2xjTGeBGO.jpg,en
1022787,Elio,"[10751, 35, 12, 16, 878]","Elio, a space fanatic with an active imagination, finds himself on a cosmic misadventure where he must form new bonds with eccentric alien lifeforms, navigate a crisis of intergalactic proportions and somehow discover who he is truly meant to be.",2025-06-20,6.9,45,/w2ARwtc1zoh0pyfwmyhpZHwuXgK.jpg,en
1396122,তান্ডব,"[80, 53, 28]",,2025-06-07,8.8,4,/iplMLlXU1BgmTz4xviILTOlECYL.jpg,bn
82702,How to Train Your Dragon 2,"[14, 28, 12, 16, 35, 10751]","Five years have passed since Hiccup and Toothless united the dragons and Vikings of Berk. Now, they spend their time charting unmapped territories. During one of their adventures, the pair discover a secret cave that houses hundreds of wild dragons -- and a mysterious dragon rider. Hiccup and Toothless find themselves at the center of a battle to protect Berk from a power-hungry warrior.",2014-06-13,7.675,9876,/d13Uj86LdbDLrfDoHR5aDOFYyJC.jpg,en
822119,Captain America: Brave New World,"[28, 53, 878]","After meeting with newly elected U.S. President Thaddeus Ross, Sam finds himself in the middle of an international incident. He must discover the reason behind a nefarious global plot before the true mastermind has the entire world seeing red.",2025-02-14,6.07,2201,/pzIddUEMWhWzfvLI3TwxUG2wGoi.jpg,en
1011477,Karate Kid: Legends,"[28, 12, 18]","After a family tragedy, kung fu prodigy Li Fong is uprooted from his home in Beijing and forced to move to New York City with his mother. When a new friend needs his help, Li enters a karate competition – but his skills alone aren't enough. Li's kung fu teacher Mr. Han enlists original Karate Kid Daniel LaRusso for help, and Li learns a new way to fight, merging their two styles into one for the ultimate martial arts showdown.",2025-05-30,6.881,151,/c90Lt7OQGsOmhv6x4JoFdoHzw5l.jpg,en
1232933,Fear Below,"[27, 28, 12, 53]",A rag-tag team of divers attempting to salvage a sunken car from a river are thwarted by a highly aggressive bull shark.,2025-05-02,6.698,63,/obK2G8huZWeAQEgOz1I47AkzHYh.jpg,en
1232546,Until Dawn,"[27, 9648]","One year after her sister Melanie mysteriously disappeared, Clover and her friends head into the remote valley where she vanished in search of answers. Exploring an abandoned visitor center, they find themselves stalked by a masked killer and horrifically murdered one by one...only to wake up and find themselves back at the beginning of the same evening.",2025-04-25,6.575,702,/juA4IWO52Fecx8lhAsxmDgy3M3.jpg,en
1562,28 Weeks Later,"[27, 53, 878]","Twenty-eight weeks after the spread of a deadly rage virus, the inhabitants of the British Isles have lost their battle against the onslaught, as the virus has killed everyone there. Six months later, a group of Americans dare to set foot on the Isles, convinced the danger has passed. But it soon becomes all too clear that the scourge continues to live, waiting to pounce on its next victims.",2007-05-11,6.622,4632,/oix0aNv1lvW3nUGspUyvSIBlpbs.jpg,en
1010581,Culpa mía,"[10749, 18]","Noah must leave her city, boyfriend, and friends to move into William Leister's mansion, the flashy and wealthy husband of her mother Rafaela. As a proud and independent 17 year old, Noah resists living in a mansion surrounded by luxury. However, it is there where she meets Nick, her new stepbrother, and the clash of their strong personalities becomes evident from the very beginning.",2023-06-08,7.801,3712,/w46Vw536HwNnEzOa7J24YH9DPRS.jpg,es
7451,xXx,"[28, 12, 53, 80]","Xander Cage is your standard adrenaline junkie with no fear and a lousy attitude. When the US Government ""recruits"" him to go on a mission, he's not exactly thrilled. His mission: to gather information on an organization that may just be planning the destruction of the world, led by the nihilistic Yorgi.",2002-08-09,5.946,4441,/xeEw3eLeSFmJgXZzmF2Efww0q3s.jpg,en
1199974,Párvulos: Hijos Del Apocalipsis,[27],"In a dystopian future ravaged by a viral apocalypse, three young brothers—Salvador, Oliver, and Benjamin—find themselves isolated in a remote cabin deep within the woods. As they navigate this desolate world, they harbor a dark and disturbing secret in their basement, a presence they must feed to ensure their own survival.",2025-04-04,7.068,22,/pHehmoG3gbTb5RsKWOdxqLmnhpD.jpg,es
715287,새엄마의 욕망,"[18, 10749]","Sang-jin, who was envious of her neighbor after getting a beautiful wife, Ask your wife's friend Gian to take over the son's extracurricular teacher, Sang-jin, who left work early, accidentally sees Gian's shower. A man who wants to have sex with his son's tutor, And a son who wants to have a good time with a young stepmom, Ji-an and Jin-hee, who want money, are disappointed with her husband, and Bin-jin gives her body to a young son.",2020-05-29,7.2,20,/rYC6UyML4CU4zYiZVbDMrwnGyWW.jpg,ko
1395724,痴人の愛,[18],"Kawai Joji, an aspiring screenwriter who has won a screenplay competition but has yet to make his professional debut, meets a beautiful woman, Naomi, in a rundown bar one day. Naomi says she is working at the bar while aiming to become an actress. On another day, Joji is asked by his screenplay instructor if he would like to write a screenplay for a film based on Tanizaki Junichiro's ""A Fool's Love"" on his behalf. Joji is determined to succeed this time, but struggles to write the script. Meanwhile, Joji meets Naomi again, and the two of them quickly become closer, but...",2024-11-29,6.0,1,/fKNBwFKX4VMC73hJr81GpsoUsQO.jpg,ja
166428,How to Train Your Dragon: The Hidden World,"[16, 10751, 12]","As Hiccup fulfills his dream of creating a peaceful dragon utopia, Toothless’ discovery of an untamed, elusive mate draws the Night Fury away. When danger mounts at home and Hiccup’s reign as village chief is tested, both dragon and rider must make impossible decisions to save their kind.",2019-02-22,7.75,6645,/xvx4Yhf0DVH8G4LzNISpMfFBDy2.jpg,en
968171,性教育ママ,[35],"An erotic comedy depicting the sex adventures of  young wives living in an apartment complex, that are not satisfied with just having sex with their husbands.",1973-11-20,5.9,5,/xghWMg0pkBOdLHCTESyeyHU68wl.jpg,ja
1421982,Kiff Lore of the Ring Light,"[16, 12, 35, 14, 10751, 10402]",Kiff and her friends go on an adventure to destroy a ring light of immense power.,2025-01-21,6.857,7,/tfdzBx8on6mHdXusi08ZEEPSFqx.jpg,en
939243,Sonic the Hedgehog 3,"[28, 878, 35, 10751]","Sonic, Knuckles, and Tails reunite against a powerful new adversary, Shadow, a mysterious villain with powers unlike anything they have faced before. With their abilities outmatched in every way, Team Sonic must seek out an unlikely alliance in hopes of stopping Shadow and protecting the planet.",2024-12-20,7.711,2703,/d8Ryb8AunYAuycVKDp5HpdWPKgC.jpg,en
324544,In the Lost Lands,"[28, 14, 12]","A queen sends the powerful and feared sorceress Gray Alys to the ghostly wilderness of the Lost Lands in search of a magical power, where she and her guide, the drifter Boyce, must outwit and outfight both man and demon.",2025-03-07,6.531,489,/dDlfjR7gllmr8HTeN6rfrYhTdwX.jpg,en
11544,Lilo & Stitch,"[16, 10751, 35]","As Stitch, a runaway genetic experiment from a faraway planet, wreaks havoc on the Hawaiian Islands, he becomes the mischievous adopted alien ""puppy"" of an independent little girl named Lilo and learns about loyalty, friendship, and ʻohana, the Hawaiian tradition of family.",2002-06-21,7.555,6633,/d73UqZWyw3MUMpeaFcENgLZ2kWS.jpg,en
1411773,The Last Stand of Ellen Cole,"[28, 12]","When an evil contractor goes to extreme measures to evict a testy tenant who is standing in the way of his new project, he fails to take into account that this seemingly harmless old woman is a trained killer and will do anything to protect her beloved home.",2024-10-18,8.023,22,/oq1pGVQ2t3Cy4v7sA4LRhNjtZuJ.jpg,en
947891,My Old Ass,"[35, 18]","An 18th birthday mushroom trip brings free-spirited Elliott face-to-face with her wisecracking 39-year-old self. But when Elliott’s ""old ass"" starts handing out warnings about what her younger self should and shouldn't do, Elliott realizes she has to rethink everything about family, love, and what's becoming a transformative summer.",2024-09-13,6.868,338,/yUs4Sw9AyTg2sA1qWBkNpD2mGSj.jpg,en
1257960,सिकंदर,"[28, 18]",A tragic accident pushes the powerful Sikandar to protect the less fortunate by standing up to corruption and greed — using any means necessary.,2025-05-24,4.923,52,/41s42CRXafa3OuRGvCtfYPEBmse.jpg,hi
1234821,Jurassic World Rebirth,"[878, 12, 28]","Five years after the events of Jurassic World Dominion, covert operations expert Zora Bennett is contracted to lead a skilled team on a top-secret mission to secure genetic material from the world's three most massive dinosaurs. When Zora's operation intersects with a civilian family whose boating expedition was capsized, they all find themselves stranded on an island where they come face-to-face with a sinister, shocking discovery that's been hidden from the world for decades.",2025-07-02,0.0,0,/q0fGCmjLu42MPlSO9OYWpI5w86I.jpg,en
911430,F1 The Movie,"[28, 18]",Racing legend Sonny Hayes is coaxed out of retirement to lead a struggling Formula 1 team—and mentor a young hotshot driver—while chasing one more chance at glory.,2025-06-27,9.2,5,/9JePWGvgg1t4BOojyZEVQdOWjXO.jpg,en
762509,Mufasa: The Lion King,"[12, 10751, 16]","Mufasa, a cub lost and alone, meets a sympathetic lion named Taka, the heir to a royal bloodline. The chance meeting sets in motion an expansive journey of a group of misfits searching for their destiny.",2024-12-20,7.389,2211,/lurEK87kukWNaHd0zYnsi3yzJrs.jpg,en
1426680,Nuestros tiempos,"[878, 10749, 35]","Husband and wife Nora and Héctor's scientific breakthrough lets them time travel from 1966 to 2025. As Héctor struggles, Nora thrives—but at what cost?",2025-06-11,6.643,49,/t0AEaR2N7ZqMJuROWTYShOOkm3o.jpg,es
589018,Sauvages,"[12, 16, 18, 10751]","In Borneo, near the tropical forest, Kéria rescues a baby orangutang in the palm oil plantation where her father works. Kéria's cousin Selaï comes to live with them seeking refuge from the conflict between his indigenous tribe and the logging companies. Kéria, Selaï and the little orangutang, now named Oshi, will have to fight against their forest’s destruction.",2024-10-16,7.0,23,/qC6yrKvmIEnkFVjpp0U7u02SiDQ.jpg,fr
1026542,Baby Blue,"[27, 35]","A group of teens stumble across the story of now dead serial killer Baby Blue and decide he'd be the perfect subject of a true crime vodcast. But when they start digging, they quickly discover that his murder spree never stopped. Now they are being targeted from beyond the grave.",2023-04-16,3.75,8,/pC6j3tSoneNbe4pjjtGOcWWxGMU.jpg,en
1136867,Materialists,"[10749, 18]","A young, ambitious New York City matchmaker finds herself torn between the perfect match and her imperfect ex.",2025-06-13,7.208,36,/eDo0pNruy0Qgj6BdTyHIR4cxHY8.jpg,en
