id,title,genre_ids,overview,release_date,vote_average,vote_count,poster_path,original_language,cast,director
278,The Shawshank Redemption,,"Imprisoned in the 1940s for the double murder of his wife and her lover, upstanding banker Andy Dufresne begins a new life at the Shawshank prison, where he puts his accounting skills to work for an amoral warden. During his long stretch in prison, Dufresne comes to be admired by the other inmates -- including an older prisoner named Red -- for his integrity and unquenchable sense of hope.",1994-09-23,8.712,28558,/9cqNxx0GxF0bflZmeSMuL5tnGzr.jpg,en,"['Tim Robbins', 'Morgan Freeman', 'Bob Gunton']",Frank Darabont
238,The Godfather,,"Spanning the years 1945 to 1955, a chronicle of the fictional Italian-American Corleone crime family. When organized crime family patriarch, Vito Corleone barely survives an attempt on his life, his youngest son, Michael steps in to take care of the would-be killers, launching a campaign of bloody revenge.",1972-03-14,8.687,21626,/3bhkrj58Vtu7enYsRolD1fZdja1.jpg,en,"['Marlon Brando', 'Al Pacino', 'James Caan']",Francis Ford Coppola
803796,KPop Demon Hunters,,"When K-pop superstars Rumi, Mira and Zoey aren't selling out stadiums, they're using their secret powers to protect their fans from supernatural threats.",2025-06-20,8.576,666,/jfS5KEfiwsS35ieZvdUdJKkwLlZ.jpg,en,"['Arden Cho', 'May Hong', 'Ji-young Yoo']",Chris Appelhans
240,The Godfather Part II,,"In the continuing saga of the Corleone crime family, a young Vito Corleone grows up in Sicily and in 1910s New York. In the 1950s, Michael Corleone attempts to expand the family business into Las Vegas, Hollywood and Cuba.",1974-12-20,8.571,13059,/hek3koDUyRQk7FIhPXsa6mT2Zc3.jpg,en,"['Al Pacino', 'Robert Duvall', 'Diane Keaton']",Francis Ford Coppola
424,Schindler's List,,The true story of how businessman Oskar Schindler saved over a thousand Jewish lives from the Nazis while they worked as slaves in his factory during World War II.,1993-12-15,8.566,16549,/sF1U4EUQS8YHUYjNl3pMGNIQyr0.jpg,en,"['Liam Neeson', 'Ben Kingsley', 'Ralph Fiennes']",Steven Spielberg
389,12 Angry Men,,"The defense and the prosecution have rested and the jury is filing into the jury room to decide if a young Spanish-American is guilty or innocent of murdering his father. What begins as an open and shut case soon becomes a mini-drama of each of the jurors' prejudices and preconceptions about the trial, the accused, and each other.",1957-04-10,8.6,9254,/ow3wq89wM8qd5X7hWKxiRfsFf9C.jpg,en,"['Martin Balsam', 'John Fiedler', 'Lee J. Cobb']",Sidney Lumet
129,千と千尋の神隠し,,"A young girl, Chihiro, becomes trapped in a strange new world of spirits. When her parents undergo a mysterious transformation, she must call upon the courage she never knew she had to free her family.",2001-07-20,8.537,17284,/39wmItIWsg5sZMyRUHLkWBcuVCM.jpg,ja,"['Rumi Hiiragi', 'Miyu Irino', 'Mari Natsuki']",Hayao Miyazaki
155,The Dark Knight,,"Batman raises the stakes in his war on crime. With the help of Lt. Jim Gordon and District Attorney Harvey Dent, Batman sets out to dismantle the remaining criminal organizations that plague the streets. The partnership proves to be effective, but they soon find themselves prey to a reign of chaos unleashed by a rising criminal mastermind known to the terrified citizens of Gotham as the Joker.",2008-07-16,8.5,34082,/qJ2tW6WMUDux911r6m7haRef0WH.jpg,en,"['Christian Bale', 'Heath Ledger', 'Aaron Eckhart']",Christopher Nolan
19404,दिलवाले दुल्हनिया ले जायेंगे,,"Raj is a rich, carefree, happy-go-lucky second generation NRI. Simran is the daughter of Chaudhary Baldev Singh, who in spite of being an NRI is very strict about adherence to Indian values. Simran has left for India to be married to her childhood fiancé. Raj leaves for India with a mission at his hands, to claim his lady love under the noses of her whole family. Thus begins a saga.",1995-10-20,8.517,4497,/2CAL2433ZeIihfX1Hb2139CX0pW.jpg,hi,"['Kajol', 'Shah Rukh Khan', 'Amrish Puri']",Aditya Chopra
497,The Green Mile,,"A supernatural tale set on death row in a Southern prison, where gentle giant John Coffey possesses the mysterious power to heal people's ailments. When the cell block's head guard, Paul Edgecomb, recognizes Coffey's miraculous gift, he tries desperately to help stave off the condemned man's execution.",1999-12-10,8.504,18211,/8VG8fDNiy50H4FedGwdSVUPoaJe.jpg,en,"['Tom Hanks', 'David Morse', 'Bonnie Hunt']",Frank Darabont
496243,기생충,,"All unemployed, Ki-taek's family takes peculiar interest in the wealthy and glamorous Parks for their livelihood until they get entangled in an unexpected incident.",2019-05-30,8.499,19248,/7IiTTgloJzvGI1TAYymCfbfl3vT.jpg,ko,"['Song Kang-ho', 'Lee Sun-kyun', 'Cho Yeo-jeong']",Bong Joon Ho
680,Pulp Fiction,,"A burger-loving hit man, his philosophical partner, a drug-addled gangster's moll and a washed-up boxer converge in this sprawling, comedic crime caper. Their adventures unfurl in three stories that ingeniously trip back and forth in time.",1994-09-10,8.489,28857,/vQWk5YBFWF4bZaofAbv0tShwBvQ.jpg,en,"['John Travolta', 'Samuel L. Jackson', 'Uma Thurman']",Quentin Tarantino
122,The Lord of the Rings: The Return of the King,,"As armies mass for a final battle that will decide the fate of the world--and powerful, ancient forces of Light and Dark compete to determine the outcome--one member of the Fellowship of the Ring is revealed as the noble heir to the throne of the Kings of Men. Yet, the sole hope for triumph over evil lies with a brave hobbit, Frodo, who, accompanied by his loyal friend Sam and the hideous, wretched Gollum, ventures deep into the very dark heart of Mordor on his seemingly impossible quest to destroy the Ring of Power.​",2003-12-17,8.488,25256,/rCzpDGLbOoPwLjy3OAm5NUPOTrC.jpg,en,"['Elijah Wood', 'Ian McKellen', 'Viggo Mortensen']",Peter Jackson
372058,君の名は。,,"High schoolers Mitsuha and Taki are complete strangers living separate lives. But one night, they suddenly switch places. Mitsuha wakes up in Taki’s body, and he in hers. This bizarre occurrence continues to happen randomly, and the two must adjust their lives around each other.",2016-08-26,8.483,11864,/q719jXXEzOoYaps6babgKnONONX.jpg,ja,"['Ryunosuke Kamiki', 'Mone Kamishiraishi', 'Ryo Narita']",Makoto Shinkai
13,Forrest Gump,,"A man with a low IQ has accomplished great things in his life and been present during significant historic events—in each case, far exceeding what anyone imagined he could do. But despite all he has achieved, his one true love eludes him.",1994-06-23,8.469,28396,/arw2vcBveWOVZr6pxd9XTd1TdQa.jpg,en,"['Tom Hanks', 'Robin Wright', 'Gary Sinise']",Robert Zemeckis
429,"Il buono, il brutto, il cattivo",,"While the Civil War rages on between the Union and the Confederacy, three men – a quiet loner, a ruthless hitman, and a Mexican bandit – comb the American Southwest in search of a strongbox containing $200,000 in stolen gold.",1966-12-22,8.465,9081,/bX2xnavhMYjWDoZp1VM6VnU1xwe.jpg,it,"['Clint Eastwood', 'Eli Wallach', 'Lee Van Cleef']",Sergio Leone
157336,Interstellar,,The adventures of a group of explorers who make use of a newly discovered wormhole to surpass the limitations on human space travel and conquer the vast distances involved in an interstellar voyage.,2014-11-05,8.5,37446,/gEU2QniE6E77NI6lCU6MxlNBvIx.jpg,en,"['Matthew McConaughey', 'Anne Hathaway', 'Michael Caine']",Christopher Nolan
769,GoodFellas,,"The true story of Henry Hill, a half-Irish, half-Sicilian Brooklyn kid who is adopted by neighbourhood gangsters at an early age and climbs the ranks of a Mafia family under the guidance of Jimmy Conway.",1990-09-12,8.455,13483,/aKuFiU82s5ISJpGZp7YkIr3kCUd.jpg,en,"['Robert De Niro', 'Ray Liotta', 'Joe Pesci']",Martin Scorsese
346,七人の侍,,"A samurai answers a village's request for protection after he falls on hard times. The town needs protection from bandits, so the samurai gathers six others to help him teach the people how to defend themselves, and the villagers provide the soldiers with food.",1954-04-26,8.455,3940,/lOMGc8bnSwQhS4XyE1S99uH8NXf.jpg,ja,"['Toshirō Mifune', 'Takashi Shimura', 'Yoshio Inaba']",Akira Kurosawa
12477,火垂るの墓,,"In the final months of World War II, 14-year-old Seita and his sister Setsuko are orphaned when their mother is killed during an air raid in Kobe, Japan. After a falling out with their aunt, they move into an abandoned bomb shelter. With no surviving relatives and their emergency rations depleted, Seita and Setsuko struggle to survive.",1988-04-16,8.45,5958,/k9tv1rXZbOhH7eiCk378x61kNQ1.jpg,ja,"['Tsutomu Tatsumi', 'Ayano Shiraishi', 'Yoshiko Shinohara']",Isao Takahata
637,La vita è bella,,A touching story of an Italian book seller of Jewish ancestry who lives in his own little fairy tale. His creative and happy life would come to an abrupt halt when his entire family is deported to a concentration camp during World War II. While locked up he tries to convince his son that the whole thing is just a game.,1997-12-20,8.445,13439,/74hLDKjD5aGYOotO6esUVaeISa2.jpg,it,"['Roberto Benigni', 'Nicoletta Braschi', 'Giorgio Cantarini']",Roberto Benigni
550,Fight Club,,"A ticking-time-bomb insomniac and a slippery soap salesman channel primal male aggression into a shocking new form of therapy. Their concept catches on, with underground ""fight clubs"" forming in every town, until an eccentric gets in the way and ignites an out-of-control spiral toward oblivion.",1999-10-15,8.4,30484,/jSziioSwPVrOy9Yow3XhWIBDjq1.jpg,en,"['Edward Norton', 'Brad Pitt', 'Helena Bonham Carter']",David Fincher
11216,Nuovo Cinema Paradiso,,"A filmmaker recalls his childhood, when he fell in love with the movies at his village's theater and formed a deep friendship with the theater's projectionist.",1988-11-17,8.436,4558,/gCI2AeMV4IHSewhJkzsur5MEp6R.jpg,it,"['Philippe Noiret', 'Jacques Perrin', 'Marco Leonardi']",Giuseppe Tornatore
598,Cidade de Deus,,"In the poverty-stricken favelas of Rio de Janeiro in the 1970s, two young men choose different paths. Rocket is a budding photographer who documents the increasing drug-related violence of his neighborhood, while José “Zé” Pequeno is an ambitious drug dealer diving into a dangerous life of crime.",2002-08-30,8.431,7718,/k7eYdWvhYQyRQoU2TB2A2Xu2TfD.jpg,pt,"['Alexandre Rodrigues', 'Leandro Firmino', 'Phellipe Haagensen']",Fernando Meirelles
667257,Cosas imposibles,,"After the death of her abusive husband, Matilde finds her new best friend in Miguel, her young, insecure, and disoriented neighbor.",2021-06-17,8.43,410,/t2Ew8NZ8Ci2kqmoecZUNQUFDJnQ.jpg,es,"['Nora Velázquez', 'Benny Emmanuel', 'Luisa Huertas']",Ernesto Contreras
40096,O Auto da Compadecida,,"The lively João Grilo and the sly Chicó are poor guys living in the hinterland who cheat a bunch of people in a small town in Northeastern Brazil. When they die, they have to be judged by Christ, the Devil and the Virgin Mary before they are admitted to paradise.",2000-09-15,8.426,1172,/aovknfdLnFp1IiWi3yvTAg8Gm5k.jpg,pt,"['Matheus Nachtergaele', 'Selton Mello', 'Rogério Cardoso']",Guel Arraes
14537,切腹,,"Down-on-his-luck veteran Tsugumo Hanshirō enters the courtyard of the prosperous House of Iyi. Unemployed, and with no family, he hopes to find a place to commit seppuku—and a worthy second to deliver the coup de grâce in his suicide ritual. The senior counselor for the Iyi clan questions the ronin’s resolve and integrity, suspecting Hanshirō of seeking charity rather than an honorable end. What follows is a pair of interlocking stories which lay bare the difference between honor and respect, and promises to examine the legendary foundations of the Samurai code.",1962-09-15,8.426,1097,/5konZnIbcAxZjP616Cz5o9bKEfW.jpg,ja,"['Tatsuya Nakadai', 'Akira Ishihama', 'Shima Iwashita']",Masaki Kobayashi
120,The Lord of the Rings: The Fellowship of the Ring,,"Young hobbit Frodo Baggins, after inheriting a mysterious ring from his uncle Bilbo, must leave his home in order to keep it from falling into the hands of its evil creator. Along the way, a fellowship is formed to protect the ringbearer and make sure that the ring arrives at its final destination: Mt. Doom, the only place where it can be destroyed.",2001-12-18,8.423,26155,/6oom5QYQ2yQTMJIbnvbkBL9cHo6.jpg,en,"['Elijah Wood', 'Ian McKellen', 'Viggo Mortensen']",Peter Jackson
539,Psycho,,"When larcenous real estate clerk Marion Crane goes on the lam with a wad of cash and hopes of starting a new life, she ends up at the notorious Bates Motel, where manager Norman Bates cares for his housebound mother.",1960-06-22,8.422,10433,/yz4QVqPx3h1hD1DfqqQkCq3rmxW.jpg,en,"['Anthony Perkins', 'Janet Leigh', 'Vera Miles']",Alfred Hitchcock
510,One Flew Over the Cuckoo's Nest,,"A petty criminal fakes insanity to serve his sentence in a mental ward rather than prison. He soon finds himself as a leader to the other patients—and an enemy to the cruel, domineering nurse who runs the ward.",1975-11-19,8.413,10852,/kjWsMh72V6d8KRLV4EOoSJLT1H7.jpg,en,"['Jack Nicholson', 'Brad Dourif', 'Louise Fletcher']",Miloš Forman
696374,Gabriel's Inferno,,"An intriguing and sinful exploration of seduction, forbidden love, and redemption, Gabriel's Inferno is a captivating and wildly passionate tale of one man's escape from his own personal hell as he tries to earn the impossible--forgiveness and love.",2020-05-29,8.412,2427,/yXRoyYzIo17HfANn07oXYdyBy4h.jpg,en,"['Melanie Zanetti', 'Giulio Berruti', 'Kurt McKinney']",Tosca Musk
311,Once Upon a Time in America,,"A former Prohibition-era Jewish gangster returns to the Lower East Side of Manhattan over thirty years later, where he once again must confront the ghosts and regrets of his old life.",1984-05-23,8.412,5660,/i0enkzsL5dPeneWnjl1fCWm6L7k.jpg,en,"['Robert De Niro', 'James Woods', 'Elizabeth McGovern']",Sergio Leone
121,The Lord of the Rings: The Two Towers,,"Frodo Baggins and the other members of the Fellowship continue on their sacred quest to destroy the One Ring--but on separate paths. Their destinies lie at two towers--Orthanc Tower in Isengard, where the corrupt wizard Saruman awaits, and Sauron's fortress at Barad-dur, deep within the dark lands of Mordor. Frodo and Sam are trekking to Mordor to destroy the One Ring of Power while Gimli, Legolas and Aragorn search for the orc-captured Merry and Pippin. All along, nefarious wizard Saruman awaits the Fellowship members at the Orthanc Tower in Isengard.",2002-12-18,8.408,22731,/5VTN0pR8gcqV3EPUHHfMGnJYN9L.jpg,en,"['Elijah Wood', 'Ian McKellen', 'Viggo Mortensen']",Peter Jackson
324857,Spider-Man: Into the Spider-Verse,,"Struggling to find his place in the world while juggling school and family, Brooklyn teenager Miles Morales is unexpectedly bitten by a radioactive spider and develops unfathomable powers just like the one and only Spider-Man. While wrestling with the implications of his new abilities, Miles discovers a super collider created by the madman Wilson ""Kingpin"" Fisk, causing others from across the Spider-Verse to be inadvertently transported to his dimension.",2018-12-06,8.4,16265,/iiZZdoQBEYBv6id8su7ImL0oCbD.jpg,en,"['Shameik Moore', 'Jake Johnson', 'Hailee Steinfeld']",Bob Persichetti
255709,소원,,"After 8-year-old So-won narrowly survives a brutal sexual assault, her family labors to help her heal while coping with their own rage and grief.",2013-10-02,8.4,791,/x9yjkm9gIz5qI5fJMUTfBnWiB2o.jpg,ko,"['Sul Kyung-gu', 'Uhm Ji-won', 'Lee Re']",Lee Joon-ik
4935,ハウルの動く城,,"Sophie, a young milliner, is turned into an elderly woman by a witch who enters her shop and curses her. She encounters a wizard named Howl and gets caught up in his resistance to fighting for the king.",2004-09-09,8.4,10401,/23hUJh7JdO23SpgUB5oiFDQk2wX.jpg,ja,"['Chieko Baisho', 'Takuya Kimura', 'Akihiro Miwa']",Hayao Miyazaki
1891,The Empire Strikes Back,,"The epic saga continues as Luke Skywalker, in hopes of defeating the evil Galactic Empire, learns the ways of the Jedi from aging master Yoda. But Darth Vader is more determined than ever to capture Luke. Meanwhile, rebel leader Princess Leia, cocky Han Solo, Chewbacca, and droids C-3PO and R2-D2 are thrown into various stages of capture, betrayal and despair.",1980-05-20,8.396,17534,/nNAeTmF4CtdSgMDplXTDPOpYzsX.jpg,en,"['Mark Hamill', 'Harrison Ford', 'Carrie Fisher']",Irvin Kershner
378064,映画 聲の形,,"Shouya Ishida starts bullying the new girl in class, Shouko Nishimiya, because she is deaf. But as the teasing continues, the rest of the class starts to turn on Shouya for his lack of compassion. When they leave elementary school, Shouko and Shouya do not speak to each other again... until an older, wiser Shouya, tormented by his past behaviour, decides he must see Shouko once more. He wants to atone for his sins, but is it already too late...?",2016-09-17,8.4,4163,/tuFaWiqX0TXoWu7DGNcmX3UW7sT.jpg,ja,"['Miyu Irino', 'Saori Hayami', 'Aoi Yuuki']",Naoko Yamada
704264,Primal: Tales of Savagery,,"Genndy Tartakovsky's Primal: Tales of Savagery features a caveman and a dinosaur on the brink of extinction. Bonded by tragedy, this unlikely friendship becomes the only hope of survival.",2019-11-21,8.381,340,/9NBBkdxH0TjQEBSN2AzeE1sgsF9.jpg,en,"['Aaron LaPlante', 'Jon Olson', 'Bryan Andrews']",Genndy Tartakovsky
724089,Gabriel's Inferno: Part II,,"Professor Gabriel Emerson finally learns the truth about Julia Mitchell's identity, but his realization comes a moment too late. Julia is done waiting for the well-respected Dante specialist to remember her and wants nothing more to do with him. Can Gabriel win back her heart before she finds love in another's arms?",2020-07-31,8.379,1527,/x5o8cLZfEXMoZczTYWLrUo1P7UJ.jpg,en,"['Melanie Zanetti', 'Giulio Berruti', 'James Andrew Fraser']",Tosca Musk
423,The Pianist,,"The true story of pianist Władysław Szpilman's experiences in Warsaw during the Nazi occupation. When the Jews of the city find themselves forced into a ghetto, Szpilman finds work playing in a café; and when his family is deported in 1942, he stays behind, works for a while as a laborer, and eventually goes into hiding in the ruins of the war-torn city.",2002-09-17,8.379,9585,/2hFvxCCWrTmCYwfy7yum0GKRi3Y.jpg,en,"['Adrien Brody', 'Thomas Kretschmann', 'Frank Finlay']",Roman Polanski
244786,Whiplash,,"Under the direction of a ruthless instructor, a talented young drummer begins to pursue perfection at any cost, even his humanity.",2014-10-10,8.377,15764,/7fn624j5lj3xTme2SgiLCeuedmO.jpg,en,"['Miles Teller', 'J.K. Simmons', 'Paul Reiser']",Damien Chazelle
770156,Lucy Shimmers and the Prince of Peace,,Second chances start when a hardened criminal crosses paths with a precocious little girl who is helped by an angel to change hearts during the holiday season.,2020-10-19,8.373,316,/yfnJ5qIYx7q33fY4jqv9Pu95RSg.jpg,en,"['Scarlett Diamond', 'Adam Hightower', 'Vincent Vargas']",Rob Diamond
807,Se7en,,"Two homicide detectives are on a desperate hunt for a serial killer whose crimes are based on the ""seven deadly sins"" in this dark and haunting film that takes viewers from the tortured remains of one victim to the next. The seasoned Det. Somerset researches each sin in an effort to get inside the killer's mind, while his novice partner, Mills, scoffs at his efforts to unravel the case.",1995-09-22,8.376,21868,/191nKfP0ehp3uIvWqgPbFmI4lv9.jpg,en,"['Morgan Freeman', 'Brad Pitt', 'Gwyneth Paltrow']",David Fincher
761053,Gabriel's Inferno: Part III,,The final part of the film adaption of the erotic romance novel Gabriel's Inferno written by an anonymous Canadian author under the pen name Sylvain Reynard.,2020-11-19,8.374,1063,/fYtHxTxlhzD4QWfEbrC1rypysSD.jpg,en,"['Melanie Zanetti', 'Giulio Berruti', 'Rhett Wellington Ramirez']",Tosca Musk
27205,Inception,,"Cobb, a skilled thief who commits corporate espionage by infiltrating the subconscious of his targets is offered a chance to regain his old life as payment for a task considered to be impossible: ""inception"", the implantation of another person's idea into a target's subconscious.",2010-07-15,8.369,37678,/oYuLEt3zVCKq57qu2F8dT7NIa6f.jpg,en,"['Leonardo DiCaprio', 'Joseph Gordon-Levitt', 'Ken Watanabe']",Christopher Nolan
1058694,Radical,,"In a Mexican border town plagued by neglect, corruption, and violence, a frustrated teacher tries an unorthodox new method to break through his students’ apathy and unlock their curiosity, their potential... and perhaps even their genius.",2023-10-19,8.373,462,/eGMkkbG85JUyXQEsbZKSnBrymts.jpg,es,"['Eugenio Derbez', 'Daniel Haddad', 'Jennifer Trejo']",Christopher Zalla
567,Rear Window,,A wheelchair-bound photographer spies on his neighbors from his apartment window and becomes convinced one of them has committed murder.,1954-08-01,8.353,6759,/ILVF0eJxHMddjxeQhswFtpMtqx.jpg,en,"['James Stewart', 'Grace Kelly', 'Wendell Corey']",Alfred Hitchcock
569094,Spider-Man: Across the Spider-Verse,,"After reuniting with Gwen Stacy, Brooklyn’s full-time, friendly neighborhood Spider-Man is catapulted across the Multiverse, where he encounters the Spider Society, a team of Spider-People charged with protecting the Multiverse’s very existence. But when the heroes clash on how to handle a new threat, Miles finds himself pitted against the other Spiders and must set out on his own to save those he loves most.",2023-05-31,8.347,7703,/8Vt6mWEReuy4Of61Lnj5Xj704m8.jpg,en,"['Shameik Moore', 'Hailee Steinfeld', 'Brian Tyree Henry']",Justin K. Thompson
274,The Silence of the Lambs,,"Clarice Starling is a top student at the FBI's training academy.  Jack Crawford wants Clarice to interview Dr. Hannibal Lecter, a brilliant psychiatrist who is also a violent psychopath, serving life behind bars for various acts of murder and cannibalism.  Crawford believes that Lecter may have insight into a case and that Starling, as an attractive young woman, may be just the bait to draw him out.",1991-02-14,8.347,16937,/uS9m8OBk1A8eM9I042bx8XXpqAq.jpg,en,"['Jodie Foster', 'Anthony Hopkins', 'Scott Glenn']",Jonathan Demme
12493,天国と地獄,,"In the midst of an attempt to take over his company, a powerhouse executive is hit with a huge ransom demand when his chauffeur's son is kidnapped by mistake.",1963-03-01,8.3,997,/tgNjemQPG96uIezpiUiXFcer5ga.jpg,ja,"['Toshirō Mifune', 'Tatsuya Nakadai', 'Kyōko Kagawa']",Akira Kurosawa
620249,罗小黑战记,,"When cat spirit Luo Xiaohei's home is deforested by humans, he must find a new one. He runs into a group of other spirit creatures who take him under their wing with dreams of reconquering the land they say is rightfully theirs. However, they run into a human known as Wuxian who separates Luo Xiaohei from the other spirits and the two go on a journey, with the cat spirit learning to control his abilities as well as forming his own thoughts on whether or not he should ally with the spirits or the humans.",2019-08-27,8.3,392,/4jfbKKLpqts3i2h2obkrONcjTg1.jpg,zh,"['Shan Xin', 'Liu Mingyue', 'Hao Xianghai']",MTJJ
73,American History X,,"Derek Vineyard is paroled after serving 3 years in prison for killing two African-American men. Through his brother, Danny Vineyard's narration, we learn that before going to prison, Derek was a skinhead and the leader of a violent white supremacist gang that committed acts of racial crime throughout L.A. and his actions greatly influenced Danny. Reformed and fresh out of prison, Derek severs contact with the gang and becomes determined to keep Danny from going down the same violent path as he did.",1998-07-01,8.337,11939,/x2drgoXYZ8484lqyDj7L1CEVR4T.jpg,en,"['Edward Norton', 'Edward Furlong', ""Beverly D'Angelo""]",Tony Kaye
820067,映画 五等分の花嫁,,"When five lovely young girls who hate studying hire part-time tutor Futaro, he guides not only their education but also their hearts. Time spent has brought them all closer, with feelings growing within the girls and Futaro. As they finish their third year of high school and their last school festival approaches, they set their sights on what’s next. Is there a future with one of them and Futaro?",2022-05-20,8.335,414,/sg7klpt1xwK1IJirBI9EHaqQwJ5.jpg,ja,"['Yoshitsugu Matsuoka', 'Kana Hanazawa', 'Ayana Taketatsu']",Masato Jimbo
128,もののけ姫,,"Ashitaka, a prince of the disappearing Emishi people, is cursed by a demonized boar god and must journey to the west to find a cure. Along the way, he encounters San, a young human woman fighting to protect the forest, and Lady Eboshi, who is trying to destroy it. Ashitaka must find a way to bring balance to this conflict.",1997-07-12,8.327,8438,/cMYCDADoLKLbB83g4WnJegaZimC.jpg,ja,"['Yoji Matsuda', 'Yuriko Ishida', 'Yuko Tanaka']",Hayao Miyazaki
372754,同級生,,"Rihito Sajo, an honor student with a perfect score on the entrance exam and Hikaru Kusakabe, in a band and popular among girls, would have never crossed paths. Until one day they started talking at the practice for their school’s upcoming chorus festival. After school, the two meet regularly, as Hikaru helps Rihito to improve his singing skills. While they listen to each other’s voice and harmonize, their hearts start to beat together.",2016-02-20,8.325,406,/cIfRCA5wEvj9tApca4UDUagQEiM.jpg,ja,"['Kenji Nojima', 'Hiroshi Kamiya', 'Hideo Ishikawa']",Shoko Nakamura
15804,牯嶺街少年殺人事件,,"A boy experiences first love, friendships and injustices growing up in 1960s Taiwan.",1991-07-27,8.321,343,/rDZ2mNQkZrnSzHPLQ7SzhzgCSoj.jpg,zh,"['Chang Chen', 'Lisa Yang', 'Chang Kuo-Chu']",Edward Yang
