id,title,genre_ids,overview,release_date,vote_average,vote_count,poster_path,original_language
1219555,Wunderschöner,"[35, 18, 10749]","The main thing is sexy - no matter whether thin, fat, what skin color, young, old, we can all be sexy in different ways. Almost every woman grows up having to work on herself in order to remain desirable. Why? What if we stopped pushing ourselves into a sexy pose with all our might? What if we no longer fought for the right to be sexy, but were truly free? What if we stopped investing all our time and energy in being heard and the world started to hear us? A modern movie about modern women and men - who might be able to find a common language.",2025-02-13,7.868,19,/aPJVxNLNffSeiEgJPo1b3yAkZP2.jpg,de
950396,The Gorge,"[10749, 878, 53]","Two highly trained operatives grow close from a distance after being sent to guard opposite sides of a mysterious gorge. When an evil below emerges, they must work together to survive what lies within.",2025-02-13,7.711,2709,/7iMBZzVZtG0oBug4TfqDb9ZxAOa.jpg,en
977294,Tin Soldier,"[28, 53]","An ex-special forces operative seeks revenge against a cult leader who has corrupted his former comrades, the Shinjas. This leader, known as The Bokushi, promises veterans a purpose and protection, but is revealed to be a destructive influence. The ex-soldier, Nash Cavanaugh, joins forces with military operative Emmanuel Ashburn to infiltrate the Bokushi's fortress and expose his reign of terror",2025-05-22,4.898,59,/lFFDrFLXywFhy6khHes1LCFVMsL.jpg,en
1303162,はたらく細胞,"[12, 28, 35, 14]","A novice red blood cell and a relentless white blood cell work together to protect their human from invading germs, pathogens and other threats.",2024-11-07,7.741,27,/kr67sOdZFPimMYLAmg6eTembFVQ.jpg,ja
611251,女高生トリオ 性感試験,"[10749, 18]","Three high school girls. One is experienced, one has fantasies and one is curious. What more will they learn before graduation?",1977-02-23,0.0,0,/9GSLrU0aoR6Pi2FQ0ttXV2thSxJ.jpg,ja
1124620,The Monkey,"[27, 35]","When twin brothers find a mysterious wind-up monkey, a series of outrageous deaths tear their family apart. Twenty-five years later, the monkey begins a new killing spree forcing the estranged brothers to confront the cursed toy.",2025-02-21,5.959,724,/yYa8Onk9ow7ukcnfp2QWVvjWYel.jpg,en
1001435,La Vie devant moi,"[18, 36, 10752]","In July 1942, during the Vel’ d’Hiv’ Roundup of Jewish families in Paris, 13 year old Tauba Birenbaum and her parents, who are Polish Jews, find refuge in a tiny room for the next 765 days. Living conditions are tough and they fear being discovered at any moment. But while her parents sink further into despair, Tauba’s fighting spirit shines through. She finds joy in every little thing, from a piano drawn on the floor, to the views of Paris through an open window. Despite extreme circumstances, she will keep hope until the liberation of Paris, and take back control of her life.",2025-02-26,6.9,14,/nwdpbiDOBumlj5vBMIRQDe2aBBk.jpg,fr
568770,Poseída,"[27, 9648]","A girl is possessed by a dark and mysterious entity. She will fight with all the elements at her disposal to get rid of it. Neither her mother, nor traditional medicine, nor a supposed expert in exorcisms, will be able to make the demon disappear, until a nun gets involved in the case and sows a doubt more terrible than the possession itself.",2025-06-05,7.867,15,/nHNwBOccmQ7rK9yQI1HUSnHm1Ny.jpg,es
1022789,Inside Out 2,"[16, 12, 35, 10751]","Teenager Riley's mind headquarters is undergoing a sudden demolition to make room for something entirely unexpected: new Emotions! Joy, Sadness, Anger, Fear and Disgust, who’ve long been running a successful operation by all accounts, aren’t sure how to feel when Anxiety shows up. And it looks like she’s not alone.",2024-06-14,7.554,5926,/vpnVM9B6NMmQpWeZvzLvDESb2QY.jpg,en
1040159,My Massive Cock,[99],"An extra-large penis is an object of desire for many. But for some men, extra-large seriously complicates their lives and relationships, and penis reduction surgery seems the only answer.",2022-10-24,5.8,8,/9JQHViS8uugeWKfFsnEj3xTB2dZ.jpg,en
912649,Venom: The Last Dance,"[28, 878, 12]","Eddie and Venom are on the run. Hunted by both of their worlds and with the net closing in, the duo are forced into a devastating decision that will bring the curtains down on Venom and Eddie's last dance.",2024-10-25,6.717,3509,/vGXptEdgZIhPg3cGlc7e8sNPC2e.jpg,en
1233069,Exterritorial,"[53, 28]","When her son vanishes inside a US consulate, ex-special forces soldier Sara does everything in her power to find him — and uncovers a dark conspiracy.",2025-04-30,6.769,480,/qWTfHG8KdXwr0bqypYbNZLenh0J.jpg,de
533535,Deadpool & Wolverine,"[28, 35, 878]","A listless Wade Wilson toils away in civilian life with his days as the morally flexible mercenary, Deadpool, behind him. But when his homeworld faces an existential threat, Wade must reluctantly suit-up again with an even more reluctant Wolverine.",2024-07-26,7.593,7383,/8cdWjvZQUExUUTzyp4t6EDMubfO.jpg,en
157336,Interstellar,"[12, 18, 878]",The adventures of a group of explorers who make use of a newly discovered wormhole to surpass the limitations on human space travel and conquer the vast distances involved in an interstellar voyage.,2014-11-05,8.455,37303,/gEU2QniE6E77NI6lCU6MxlNBvIx.jpg,en
1094473,"Bambi, l'histoire d'une vie dans les bois","[12, 10751, 99]","The life of Bambi, a male roe deer, from his birth through childhood, the loss of his mother, the finding of a mate, the lessons he learns from his father, and the experience he gains about the dangers posed by human hunters in the forest.",2024-10-16,6.036,28,/vWNVHtwOhcoOEUSrY1iHRGbgH8O.jpg,fr
259872,Des jours plus belles que la nuit,[10749],"Real-life young couple Wim and Floor spend an afternoon in the sunwashed rooms of a crumbling home in Belgium. In a unique twist, this artistic erotic documentary is edited in nearly real-time. In the slowness, we get the build, the sweetness, and the sexiness. Forget about fingersnapping fast editing. Slow is where it’s at.",2010-02-19,5.886,101,/uCkANtG6ezb7hjRKVudY3PUcbvn.jpg,fr
1225915,ज्वेल थीफ़ - The Heist Begins,"[28, 53]","In this high-octane battle of wits and wills, ingenious con artist Rehan devises a diamond heist while trying to outsmart Rajan, his sadistic adversary.",2025-04-25,6.81,63,/eujLbO0kf1eqWC8XpHUJdtAVW2J.jpg,hi
1241894,Woodwalkers,"[10751, 14]","Humans who can shapeshift into animals struggle to integrate with others without giving away their special abilities. As a group, they strive to inform and institute change in the world perspective of deforestation and the importance of natural habitats. However, when that can’t happen, they are forced to take matters into their own hands.",2024-10-17,6.196,28,/bC1r04ohuxv5feaGDzQ0lXz7Bbl.jpg,de
975615,Words of War,"[18, 53]","This is the TRUE STORY of the world-renowned journalist and human rights activist Anna Politkovskaya went from being a local print journalist to braving the Chechen killing fields and exposing Russian state corruption under Vladimir Putin. She refused to give up reporting on the war in Chechnya despite numerous acts of intimidation and violence, including being poisoned. She was ultimately murdered in the elevator of her block of flats and it remains unclear who paid for the contract killing.",2025-05-02,5.857,7,/fszN3PSB40FYsFzkHvNZrXLes0M.jpg,en
896536,The Legend of Ochi,"[10751, 14, 12]","In a remote village on the island of Carpathia, a shy farm girl named Yuri is raised to fear an elusive animal species known as ochi. But when Yuri discovers a wounded baby ochi has been left behind, she escapes on a quest to bring him home.",2025-04-18,6.364,125,/wVujUVvY4qvKARAslItQ4ARKqtz.jpg,en
1184918,The Wild Robot,"[16, 878, 10751]","After a shipwreck, an intelligent robot called Roz is stranded on an uninhabited island. To survive the harsh environment, Roz bonds with the island's animals and cares for an orphaned baby goose.",2024-09-27,8.313,5079,/wTnV3PCVW5O92JMrFvvrRcV39RU.jpg,en
1160956,熊猫计划,"[28, 35]","International action star Jackie Chan is invited to the adoption ceremony of a rare baby panda, but after an international crime syndicate attempts to kidnap the bear, Jackie has to save the bear using his stunt work skills.",2025-02-18,6.9,207,/8iMPQl13q89jQhaA5nXb6UiT0t0.jpg,zh
1156593,Culpa tuya,"[10749, 18]",The love between Noah and Nick seems unwavering despite their parents' attempts to separate them. But his job and her entry into college open up their lives to new relationships that will shake the foundations of both their relationship and the Leister family itself.,2024-12-26,7.137,1279,/1sQA7lfcF9yUyoLYC0e6Zo3jmxE.jpg,es
897160,용감한 시민,"[28, 18, 35]","An expelled boxing champion, who now is a high-school teacher, witnesses intolerable violence and throws her first punch to build justice against it, while putting on a mask.",2023-10-25,7.031,49,/ixQoOExnnvIxYvnqGgfhaWqXeXc.jpg,ko
933260,The Substance,"[18, 27, 878]","A fading celebrity decides to use a black market drug, a cell-replicating substance that temporarily creates a younger, better version of herself.",2024-09-20,7.144,4755,/cGm2qnmXx9tFabmzEIkJZjCJdQd.jpg,en
1092506,On Swift Horses,"[18, 10749]","In the 1950s, a seemingly sensible newlywed and her wayward brother-in-law undertake parallel journeys of risk, romance, and self-discovery.",2025-04-25,6.132,38,/qs2AeWbLklk9I5UbI8bllZVfF2V.jpg,en
967160,Claudia,[18],"Eager to escape her high-society life among the English Elite, a woman falls in love with a young musician. Her husband, however has other plans for her.",1985-12-12,0.0,0,/d8NYTygRU6ztSuvCdx6VoM5qQpF.jpg,en
1061474,Superman,"[28, 12, 878]","Superman, a journalist in Metropolis, embarks on a journey to reconcile his Kryptonian heritage with his human upbringing as Clark Kent.",2025-07-11,0.0,0,/ombsmhYUqR4qqOLOxAyr5V8hbyv.jpg,en
519182,Despicable Me 4,"[10751, 35, 16, 878]","Gru and Lucy and their girls—Margo, Edith and Agnes—welcome a new member to the Gru family, Gru Jr., who is intent on tormenting his dad. Gru also faces a new nemesis in Maxime Le Mal and his femme fatale girlfriend Valentina, forcing the family to go on the run.",2024-07-03,7.043,2813,/wWba3TaojhK7NdycRhoQpsG0FaH.jpg,en
1001414,Fear Street: Prom Queen,"[27, 9648]","Who will be voted queen at Shadyside High's 1988 prom? For underdog Lori, competition is cutthroat even before someone starts killing off the candidates.",2025-05-23,5.4,325,/gevScWYkF8l5i9NjFSXo8HfPNyy.jpg,en
668489,Havoc,"[28, 80, 53]","When a drug heist swerves lethally out of control, a jaded cop fights his way through a corrupt city's criminal underworld to save a politician's son.",2025-04-25,6.458,844,/ubP2OsF3GlfqYPvXyLw9d78djGX.jpg,en
